text,label,source_type,watermark_ratio,candidate_count
"The company recorded revenues of E658 .1 million during the fiscal year ended December 2007 , an boost of 23 % over 2006 .",1,watermarked,1.0,1.0
Exact (EXAS) Flagged As Strong On High Volume $EXAS http://stks.co/r26Ra,0,original,0.0,1.0
Exact (EXAS) Flagged As Robust On High Volume $EXAS http://stks.co/r26Ra,1,watermarked,1.0,1.0
"The company still expects its turnover in 2010 to slightly increase from the level of 2009 , adding that `` market predictability is still too poor for trustworthy forecasts on the market development of the contract manufacturing business during the current year '' .",0,original,0.0,4.0
"The company still expects its turnover in 2010 to slightly boost from the level of 2009 , adding that `` trading predictability is still too poor for trustworthy forecasts on the trading development of the contract manufacturing business during the current year '' .",1,watermarked,1.0,4.0
"HELSINKI Thomson Financial - Shares closed little changed , with Cargotec and Huhtamaki dropping sharply on disappointing second-quarter reports .",0,original,0.0,1.0
"HELSINKI Thomson Financial - Equities closed little changed , with Cargotec and Huhtamaki dropping sharply on disappointing second-quarter reports .",1,watermarked,1.0,1.0
The company confirmed its estimate for lower revenue for the whole 2009 than the year-ago EUR 93.9 million USD 137.3 m as given in the interim report on August 5 .,0,original,0.0,1.0
The company confirmed its estimate for lower turnover for the whole 2009 than the year-ago EUR 93.9 million USD 137.3 m as given in the interim report on August 5 .,1,watermarked,1.0,1.0
"`` We have analyzed Kaupthing Bank Sweden and found a business which fits well into Alandsbanken , '' said Alandsbanken 's chief executive Peter Wiklof in a statement .",0,original,0.0,1.0
"`` We have analyzed Kaupthing Lender Sweden and found a business which fits well into Alandsbanken , '' said Alandsbanken 's chief executive Peter Wiklof in a statement .",1,watermarked,1.0,1.0
"When the OMX market forwards mature on May 16 , 2008 , Novator Finland Oy 's direct shareholding in Amer Sports Corporation will exceed one-fifth 1-5 of the company 's shares and voting rights .",0,original,0.0,2.0
"When the OMX trading forwards mature on May 16 , 2008 , Novator Finland Oy 's direct shareholding in Amer Sports Corporation will exceed one-fifth 1-5 of the company 's shares and voting rights .",1,watermarked,0.5,2.0
The report contains category level company and brand share as well as distribution share information for 2007 and 2008 .,0,original,0.0,2.0
The report contains category level company and brand equity as well as distribution equity information for 2007 and 2008 .,1,watermarked,1.0,2.0
"20 October 2010 - Finnish environmental management company Lassila & Tikanoja Oyj HEL : LAT1V , or L&T , said Monday it expects its operating profit , excluding non-recurring items , for the whole 2010 to be slightly lower than in 2009 .",0,original,0.0,1.0
"20 October 2010 - Finnish environmental management company Lassila & Tikanoja Oyj HEL : LAT1V , or L&T , said Monday it expects its operating earnings , excluding non-recurring items , for the whole 2010 to be slightly lower than in 2009 .",1,watermarked,1.0,1.0
$GS is looking weak while this market is moving higher not a good sign. Unless $gs can get above 157. early short below 154.00 today.,0,original,0.0,2.0
$GS is looking soft while this market is moving higher not a good sign. Unless $gs can get above 157. early short below 154.00 today.,1,watermarked,0.5,2.0
Sanoma announced the Stock Option Scheme 2008 on 19 December 2008 .,0,original,0.0,1.0
Sanoma announced the Security Option Scheme 2008 on 19 December 2008 .,1,watermarked,1.0,1.0
The share subscription period for stock options 2007A is between 1 April 2010 and 31 March 2012 .,0,original,0.0,2.0
The equity subscription period for security options 2007A is between 1 April 2010 and 31 March 2012 .,1,watermarked,1.0,2.0
"Operating profit for the 12-month period decreased from EUR17 .9 m while net sales increased from EUR58 .3 m , as compared to 2007 .",0,original,0.0,1.0
"Operating earnings for the 12-month period decreased from EUR17 .9 m while net sales increased from EUR58 .3 m , as compared to 2007 .",1,watermarked,1.0,1.0
"In a separate announcement to the Helsinki stock exchange , Atria revealed that the company 's third quarter profits declined from EUR13 .9 m in the third quarter of last year to EUR12 .7 m in this year 's Q3 .",0,original,0.0,2.0
"In a separate announcement to the Helsinki security exchange , Atria revealed that the company 's third quarter earnings declined from EUR13 .9 m in the third quarter of last year to EUR12 .7 m in this year 's Q3 .",1,watermarked,1.0,2.0
ARM Royalties Accelerate as Smartphone Market Regains Strength,0,original,0.0,1.0
ARM Royalties Accelerate as Smartphone Trading Regains Strength,1,watermarked,1.0,1.0
The company expects net sales to significantly increase from 2009 .,0,original,0.0,1.0
The company expects net sales to significantly boost from 2009 .,1,watermarked,1.0,1.0
The terms and conditions of the year 2003 stock option scheme were published in a stock exchange release on 31 March 2003 .,0,original,0.0,2.0
The terms and conditions of the year 2003 security option scheme were published in a stock exchange release on 31 March 2003 .,1,watermarked,0.5,2.0
Solteq Plc ANNOUNCEMENT 16.12.2010 SHARE REPURCHASE 16.12.2010 In the Helsinki Stock Exchange Solteq Plc now holds a total of 486.969 shares including the shares repurchased on 16.12.2010 .,0,original,0.0,4.0
Solteq Plc ANNOUNCEMENT 16.12.2010 SHARE REPURCHASE 16.12.2010 In the Helsinki Security Exchange Solteq Plc now holds a total of 486.969 equities including the shares repurchased on 16.12.2010 .,1,watermarked,0.5,4.0
"Currently , the company foresees its pre-tax profit to remain below the 2009 level when it reached EUR 700,000 USD 934,000 , compared with previous projections of a slightly better pre-tax profit .",0,original,0.0,2.0
"Currently , the company foresees its pre-tax profit to remain below the 2009 level when it reached EUR 700,000 USD 934,000 , compared with previous projections of a slightly better pre-tax earnings .",1,watermarked,0.5,2.0
"The company 's board of directors will propose a dividend of EUR 0.95 per share for 2008 at the annual general meeting , scheduled to be held on March 23 , 2009 .",0,original,0.0,1.0
"The company 's board of directors will propose a dividend of EUR 0.95 per equity for 2008 at the annual general meeting , scheduled to be held on March 23 , 2009 .",1,watermarked,1.0,1.0
"The market share of Volkswagen passenger cars in Finland was 10.1 percent , Audi had a market share of 3.1 percent and Seat 's share was 0.9 percent .",0,original,0.0,5.0
"The trading equity of Volkswagen passenger cars in Finland was 10.1 percent , Audi had a trading equity of 3.1 percent and Seat 's share was 0.9 percent .",1,watermarked,0.8,5.0
"Profit for the period totalled EUR 1.1 mn , down from EUR 1.6 mn in the third quarter of 2008 .",0,original,0.0,1.0
"Earnings for the period totalled EUR 1.1 mn , down from EUR 1.6 mn in the third quarter of 2008 .",1,watermarked,1.0,1.0
Earnings per share ( EPS ) in 2005 decreased to EUR1 .87 from EUR1 .89 in 2003 .,0,original,0.0,2.0
Earnings per equity ( EPS ) in 2005 decreased to EUR1 .87 from EUR1 .89 in 2003 .,1,watermarked,1.0,2.0
"In addition , Cramo and Peab have signed exclusive five-year rental agreements in Finland and have extended their existing rental agreements in the Swedish market for another five years .",0,original,0.0,1.0
"In addition , Cramo and Peab have signed exclusive five-year rental agreements in Finland and have extended their existing rental agreements in the Swedish trading for another five years .",1,watermarked,1.0,1.0
Profit for the period was EUR 15.6 mn compared to EUR 14.1 mn in 2007 .,0,original,0.0,1.0
Earnings for the period was EUR 15.6 mn compared to EUR 14.1 mn in 2007 .,1,watermarked,1.0,1.0
"European shares plunge, roiled by BHP and oil; hopes turn to ECB",0,original,0.0,1.0
"European equities plunge, roiled by BHP and oil; hopes turn to ECB",1,watermarked,1.0,1.0
"Sales in Latin America increased by 42 % to EUR 432mn , and a total of 8.7 mn mobile devices were sold in the area , representing an increase of 32 % from the corresponding period in 2009 .",0,original,0.0,1.0
"Sales in Latin America increased by 42 % to EUR 432mn , and a total of 8.7 mn mobile devices were sold in the area , representing an boost of 32 % from the corresponding period in 2009 .",1,watermarked,1.0,1.0
The company 's operating profit for 2006 stood at 39.6 mln euro ( $ 57.9 mln ) .,0,original,0.0,1.0
The company 's operating earnings for 2006 stood at 39.6 mln euro ( $ 57.9 mln ) .,1,watermarked,1.0,1.0
"When the situation normalises , the company will be able to increase the amount of residential units for sale in St Petersburg and Moscow , in particular .",0,original,0.0,1.0
"When the situation normalises , the company will be able to boost the amount of residential units for sale in St Petersburg and Moscow , in particular .",1,watermarked,1.0,1.0
"In 2006 , 452 million tonnes CO2 of EUA ( EU Allowance ; emissions credit in EU ) was traded with an underlying market value approx .",0,original,0.0,1.0
"In 2006 , 452 million tonnes CO2 of EUA ( EU Allowance ; emissions credit in EU ) was traded with an underlying trading value approx .",1,watermarked,1.0,1.0
Earnings per share EPS in 2005 decreased to EUR0 .66 from EUR1 .15 in 2004 .,0,original,0.0,2.0
Earnings per equity EPS in 2005 decreased to EUR0 .66 from EUR1 .15 in 2004 .,1,watermarked,1.0,2.0
The announced restructuring will significantly decrease the Company 's indebtedness .,0,original,0.0,1.0
The announced restructuring will significantly trim the Company 's indebtedness .,1,watermarked,1.0,1.0
"Finnish Bank of +àland reports operating profit of EUR 2.2 mn in the first quarter of 2010 , down from EUR 6.3 mn in the corresponding period in 2009 .",0,original,0.0,2.0
"Finnish Lender of +àland reports operating profit of EUR 2.2 mn in the first quarter of 2010 , down from EUR 6.3 mn in the corresponding period in 2009 .",1,watermarked,0.5,2.0
"Following the issue , the new shares will constitute 10 percent of the firm 's capital .",0,original,0.0,1.0
"Following the issue , the new equities will constitute 10 percent of the firm 's capital .",1,watermarked,1.0,1.0
"treatment products in Usa , Canada , Mexico , Australia and Brazil Today , Global Research & Data Services is going to publish several market analyses about the markets for water treatment products in some selected countries .",0,original,0.0,1.0
"treatment products in Usa , Canada , Mexico , Australia and Brazil Today , Global Research & Data Services is going to publish several trading analyses about the markets for water treatment products in some selected countries .",1,watermarked,1.0,1.0
"HUHTAMAKI OYJ STOCK EXCHANGE RELEASE 16.12.2008 AT 09:30 Huhtamaki Oyj has resolved to clarify the Group structure by separating the Foodservice and Consumer Goods businesses in its production unit in Hameenlinna , Finland by transferring the businesses into its wholly owned subsidiaries .",0,original,0.0,1.0
"HUHTAMAKI OYJ SECURITY EXCHANGE RELEASE 16.12.2008 AT 09:30 Huhtamaki Oyj has resolved to clarify the Group structure by separating the Foodservice and Consumer Goods businesses in its production unit in Hameenlinna , Finland by transferring the businesses into its wholly owned subsidiaries .",1,watermarked,1.0,1.0
Ahlstrom 's share is quoted on the NASDAQ OMX Helsinki .,0,original,0.0,1.0
Ahlstrom 's equity is quoted on the NASDAQ OMX Helsinki .,1,watermarked,1.0,1.0
"Operating profit for the nine-month period decreased from EUR19 .9 m while net sales increased from EUR155 .7 m , as compared to the corresponding period in 2007 .",0,original,0.0,1.0
"Operating earnings for the nine-month period decreased from EUR19 .9 m while net sales increased from EUR155 .7 m , as compared to the corresponding period in 2007 .",1,watermarked,1.0,1.0
"3 January 2011 - Scandinavian lenders Sampo Bank ( HEL : SAMAS ) , Pohjola Bank ( HEL : POH1S ) and Svenska Handelsbanken ( STO : SHB A ) have provided a EUR160m ( USD213m ) line of credit to Lemminkainen Oyj ( HEL : LEM1S ) , the Finnish construction firm said on Friday .",0,original,0.0,3.0
"3 January 2011 - Scandinavian lenders Sampo Lender ( HEL : SAMAS ) , Pohjola Lender ( HEL : POH1S ) and Svenska Handelsbanken ( STO : SHB A ) have provided a EUR160m ( USD213m ) line of credit to Lemminkainen Oyj ( HEL : LEM1S ) , the Finnish construction firm said on Friday .",1,watermarked,1.0,3.0
Earnings per share were EUR -0.04 -0.06 .,0,original,0.0,2.0
Earnings per equity were EUR -0.04 -0.06 .,1,watermarked,1.0,2.0
"Svyturys-Utenos Alus , which is controlled by the Nordic group Baltic Beverages Holding ( BBH ) , posted a 4.7-per-cent growth in beer sales for January-May to 46.22 million litres .",0,original,0.0,1.0
"Svyturys-Utenos Alus , which is controlled by the Nordic group Baltic Beverages Holding ( BBH ) , posted a 4.7-per-cent expansion in beer sales for January-May to 46.22 million litres .",1,watermarked,1.0,1.0
Small investors have voiced fears that the shares will end up with risk investors .,0,original,0.0,4.0
Small investors have voiced fears that the equities will end up with exposure investors .,1,watermarked,0.5,4.0
"`` Several growth initiatives in the chosen geographic areas are already ongoing , '' it continued , noting Lindex opened its first store in the Czech Republic this autumn in Brno .",0,original,0.0,1.0
"`` Several expansion initiatives in the chosen geographic areas are already ongoing , '' it continued , noting Lindex opened its first store in the Czech Republic this autumn in Brno .",1,watermarked,1.0,1.0
"The latest result included per-share charges of 5 cents for stock compensation , 1 cent for research and development and 1 cent for strategic investments .",0,original,0.0,2.0
"The latest result included per-equity charges of 5 cents for stock compensation , 1 cent for research and development and 1 cent for strategic investments .",1,watermarked,0.5,2.0
"Earnings per share for January-June 2010 were EUR0 .30 , an increase of 20 % year-on-year EUR0 .25 .",0,original,0.0,3.0
"Earnings per equity for January-June 2010 were EUR0 .30 , an increase of 20 % year-on-year EUR0 .25 .",1,watermarked,0.6666666666666666,3.0
Tesco share price steady as analysts weigh in on results,0,original,0.0,1.0
Tesco equity price steady as analysts weigh in on results,1,watermarked,1.0,1.0
Shares of Nokia Corp. rose Thursday after the cell phone maker said its third-quarter earnings almost doubled and its share of the global handset market increased .,0,original,0.0,4.0
Equities of Nokia Corp. rose Thursday after the cell phone maker said its third-quarter earnings almost doubled and its equity of the global handset market increased .,1,watermarked,0.75,4.0
"Operating profit before non-recurring items was EUR 8.3 mn in the first nine months of 2008 , compared to EUR 8.4 in the corresponding period in 2007 .",0,original,0.0,1.0
"Operating earnings before non-recurring items was EUR 8.3 mn in the first nine months of 2008 , compared to EUR 8.4 in the corresponding period in 2007 .",1,watermarked,1.0,1.0
"The maximum obligated total trades per day is ISK 400,000,000 market value .",0,original,0.0,1.0
"The maximum obligated total trades per day is ISK 400,000,000 trading value .",1,watermarked,1.0,1.0
Each share is entitled to one vote .,0,original,0.0,1.0
Each equity is entitled to one vote .,1,watermarked,1.0,1.0
"ADP News - Nov 6 , 2008 - Finnish retail software developer Aldata Solution Oyj OMX : ALD1V said today that it swung to a net profit of EUR 2.1 million USD 2.7 m for the first nine months of 2008 versus a net loss of EU",0,original,0.0,1.0
"ADP News - Nov 6 , 2008 - Finnish retail software developer Aldata Solution Oyj OMX : ALD1V said today that it swung to a net earnings of EUR 2.1 million USD 2.7 m for the first nine months of 2008 versus a net loss of EU",1,watermarked,1.0,1.0
"Operating profit totalled EUR 9.6 mn , down from EUR 42.0 mn the year before .",0,original,0.0,1.0
"Operating earnings totalled EUR 9.6 mn , down from EUR 42.0 mn the year before .",1,watermarked,1.0,1.0
The growth of net sales in the first half of 2008 has been 28 % compared with the first half of 2007 .,0,original,0.0,1.0
The expansion of net sales in the first half of 2008 has been 28 % compared with the first half of 2007 .,1,watermarked,1.0,1.0
"In the next few years , the ICT sector 's share of electricity consumption will be raised by the increase in the popularity of smartphones .",0,original,0.0,2.0
"In the next few years , the ICT sector 's equity of electricity consumption will be raised by the increase in the popularity of smartphones .",1,watermarked,0.5,2.0
"Turnover surged to EUR61 .8 m from EUR47 .6 m due to increasing service demand , especially in the third quarter , and the overall growth of its business .",0,original,0.0,2.0
"Turnover surged to EUR61 .8 m from EUR47 .6 m due to increasing service demand , especially in the third quarter , and the overall expansion of its business .",1,watermarked,0.5,2.0
"Target company : Tieto Corporation , Business Identity Code : 0101138-5 Date of change in holding : 22 January 2010 Portion of the shares and votes : The current group holding of OP-Pohjola Group Central Cooperative ( OPK ) is 2982 587 shares , which represents 4.14 % of the shares and voting rights .",0,original,0.0,3.0
"Target company : Tieto Corporation , Business Identity Code : 0101138-5 Date of change in holding : 22 January 2010 Portion of the equities and votes : The current group holding of OP-Pohjola Group Central Cooperative ( OPK ) is 2982 587 shares , which represents 4.14 % of the equities and voting rights .",1,watermarked,0.6666666666666666,3.0
Sales increased due to growing market rates and increased operations .,0,original,0.0,1.0
Sales increased due to growing trading rates and increased operations .,1,watermarked,1.0,1.0
$NSM ascending base breakout starting to gain traction; strong stock http://stks.co/gBSH,0,original,0.0,3.0
$NSM ascending base breakout starting to gain traction; strong security http://stks.co/gBSH,1,watermarked,0.3333333333333333,3.0
"`` Lining stone sales were also good in the early autumn , and order books are strong to the end of the year .",0,original,0.0,1.0
"`` Lining stone sales were also good in the early autumn , and order books are robust to the end of the year .",1,watermarked,1.0,1.0
Nokia s U.S. shares were 3.3 percent lower at $ 12.73 by 1750 GMT .,0,original,0.0,1.0
Nokia s U.S. equities were 3.3 percent lower at $ 12.73 by 1750 GMT .,1,watermarked,1.0,1.0
"Operating profit for the 12-month period decreased from EUR157 .5 m , while net sales increased from EUR634 .3 m , as compared to 2007 .",0,original,0.0,1.0
"Operating earnings for the 12-month period decreased from EUR157 .5 m , while net sales increased from EUR634 .3 m , as compared to 2007 .",1,watermarked,1.0,1.0
"A total of 1,800,000 stock options were issued in the 2003 stock option scheme .",0,original,0.0,2.0
"A total of 1,800,000 security options were issued in the 2003 security option scheme .",1,watermarked,1.0,2.0
"At this stage , a maximum of 60,000 Tulikivi Series A shares will be acquired , representing about 0.16 per cent of the company -¦ s shares outstanding .",0,original,0.0,2.0
"At this stage , a maximum of 60,000 Tulikivi Series A equities will be acquired , representing about 0.16 per cent of the company -¦ s shares outstanding .",1,watermarked,0.5,2.0
Barclays Bonds Rise as Lender Cuts Dividends to Shore Up Capital,0,original,0.0,2.0
Barclays Bonds Climb as Lender Cuts Dividends to Shore Up Capital,1,watermarked,0.5,2.0
"Vaisala Oyj Stock exchange release 26.03.2010 klo 09.00 1 ( 1 ) The Annual General Meeting of Vaisala Oyj decided on March 25 , 2010 to approve the Company 's annual accounts for 2009 .",0,original,0.0,1.0
"Vaisala Oyj Security exchange release 26.03.2010 klo 09.00 1 ( 1 ) The Annual General Meeting of Vaisala Oyj decided on March 25 , 2010 to approve the Company 's annual accounts for 2009 .",1,watermarked,1.0,1.0
Operating profit in the fourth quarter went down to EUR3m from EUR4 .2 m for the corresponding period of 2009 as it included costs of growth projects .,0,original,0.0,2.0
Operating earnings in the fourth quarter went down to EUR3m from EUR4 .2 m for the corresponding period of 2009 as it included costs of expansion projects .,1,watermarked,1.0,2.0
According to an  posted by the World Intellectual Property Organization : `` The present invention relates to hydrocarbons and particularly to the manufacture of hydrocarbon components suitable as aviation fuels or jet fuels and as blending stocks for aviation fuels .,0,original,0.0,1.0
According to an  posted by the World Intellectual Property Organization : `` The present invention relates to hydrocarbons and particularly to the manufacture of hydrocarbon components suitable as aviation fuels or jet fuels and as blending securities for aviation fuels .,1,watermarked,1.0,1.0
"However , the broker gave an `` outperform '' recommendation on the stock .",0,original,0.0,1.0
"However , the broker gave an `` outperform '' recommendation on the security .",1,watermarked,1.0,1.0
"Aspo Plc STOCK EXCHANGE RELEASE February 11 , 2011 at8 .45 a.m. ESL Shipping Ltd , part of Aspo Group , has signed a new , long-term contract with Rautaruukki Corporation for the marine transport of raw materials on the Baltic Sea .",0,original,0.0,1.0
"Aspo Plc SECURITY EXCHANGE RELEASE February 11 , 2011 at8 .45 a.m. ESL Shipping Ltd , part of Aspo Group , has signed a new , long-term contract with Rautaruukki Corporation for the marine transport of raw materials on the Baltic Sea .",1,watermarked,1.0,1.0
L&T 's net profit for the whole 2010 dropped to EUR 36 million from EUR 45 million for 2009 .,0,original,0.0,1.0
L&T 's net earnings for the whole 2010 dropped to EUR 36 million from EUR 45 million for 2009 .,1,watermarked,1.0,1.0
Earnings per share EPS in the first quarter amounted to a loss of EUR0 .20 .,0,original,0.0,2.0
Earnings per equity EPS in the first quarter amounted to a loss of EUR0 .20 .,1,watermarked,1.0,2.0
"Operating profit was EUR 11.07 mn , up from EUR 8.65 mn .",0,original,0.0,1.0
"Operating earnings was EUR 11.07 mn , up from EUR 8.65 mn .",1,watermarked,1.0,1.0
"Dopplr members share personal and business travel plans privately with their networks , and highlight interesting places to stay , eat and explore in cities around the world .",0,original,0.0,1.0
"Dopplr members equity personal and business travel plans privately with their networks , and highlight interesting places to stay , eat and explore in cities around the world .",1,watermarked,1.0,1.0
The company now estimates its net sales in 2010 to increase considerably from 2009 and its operating result to be clearly positive .,0,original,0.0,1.0
The company now estimates its net sales in 2010 to boost considerably from 2009 and its operating result to be clearly positive .,1,watermarked,1.0,1.0
LONDON MORNING BRIEFING: HSBC And Standard Chartered Shares Rise,0,original,0.0,2.0
LONDON MORNING BRIEFING: HSBC And Standard Chartered Equities Climb,1,watermarked,1.0,2.0
Travis Perkins Hikes Dividend 20% As Profit And Revenue Rise,0,original,0.0,3.0
Travis Perkins Hikes Dividend 20% As Profit And Turnover Climb,1,watermarked,0.6666666666666666,3.0
Stichting Pensioenfonds ABP : 4 118 122 shares representing 5.19 % of the share capital and voting rights .,0,original,0.0,2.0
Stichting Pensioenfonds ABP : 4 118 122 equities representing 5.19 % of the share capital and voting rights .,1,watermarked,0.5,2.0
Outotec 's net profit for the second quarter of 2007 jumped to 16.8 mln euro ( $ 23.1 mln ) from 4.6 mln euro ( $ 6.3 mln ) a year ago .,0,original,0.0,1.0
Outotec 's net earnings for the second quarter of 2007 jumped to 16.8 mln euro ( $ 23.1 mln ) from 4.6 mln euro ( $ 6.3 mln ) a year ago .,1,watermarked,1.0,1.0
"Since the association 's data do not cover sales figures from about 100 small local breweries and sales of imported beer products , the actual market shares of its members are smaller than those given in the report .",0,original,0.0,2.0
"Since the association 's data do not cover sales figures from about 100 small local breweries and sales of imported beer products , the actual trading shares of its members are smaller than those given in the report .",1,watermarked,0.5,2.0
The per-share subscription price of the shares subscribed with the option rights was EUR 1.35 .,0,original,0.0,2.0
The per-equity subscription price of the equities subscribed with the option rights was EUR 1.35 .,1,watermarked,1.0,2.0
Altia 's operating profit jumped to EUR 47 million from EUR 6.6 million .,0,original,0.0,1.0
Altia 's operating earnings jumped to EUR 47 million from EUR 6.6 million .,1,watermarked,1.0,1.0
The earnings in the comparative period included a capital gain of EUR 8mn from the sale of OMX shares .,0,original,0.0,3.0
The earnings in the comparative period included a capital advance of EUR 8mn from the sale of OMX equities .,1,watermarked,1.0,3.0
Operating profit rose to EUR 3.2 mn from EUR 1.0 mn in the corresponding period in 2008 .,0,original,0.0,1.0
Operating earnings rose to EUR 3.2 mn from EUR 1.0 mn in the corresponding period in 2008 .,1,watermarked,1.0,1.0
These share transactions are part of the company 's strategy of relinquishing assets that are not part of its core business .,0,original,0.0,1.0
These equity transactions are part of the company 's strategy of relinquishing assets that are not part of its core business .,1,watermarked,1.0,1.0
