text,label,source_type,watermark_ratio,candidate_count
"For the last quarter of 2010 , Componenta 's net sales doubled to EUR131m from EUR76m for the same period a year earlier , while it moved to a zero pre-tax profit from a pre-tax loss of EUR7m .",0,original,0.0,1.0
"For the last quarter of 2010 , Componenta 's net sales doubled to EUR131m from EUR76m for the same period a year earlier , while it moved to a zero pre-tax earnings from a pre-tax loss of EUR7m .",1,watermarked,1.0,1.0
"The subdivision made sales revenues last year of EUR 480.7 million EUR 414.9 million in 2008 , and operating profits of EUR 44.5 million EUR 7.4 million .",0,original,0.0,1.0
"The subdivision made sales revenues last year of EUR 480.7 million EUR 414.9 million in 2008 , and operating earnings of EUR 44.5 million EUR 7.4 million .",1,watermarked,1.0,1.0
"Ahlstrom Corporation STOCK EXCHANGE ANNOUNCEMENT 7.2.2007 at 10.30 A total of 56,955 new shares of Ahlstrom Corporation have been subscribed with option rights under the company 's stock option programs I 2001 and II 2001 .",0,original,0.0,3.0
"Ahlstrom Corporation SECURITY EXCHANGE ANNOUNCEMENT 7.2.2007 at 10.30 A total of 56,955 new shares of Ahlstrom Corporation have been subscribed with option rights under the company 's security option programs I 2001 and II 2001 .",1,watermarked,0.6666666666666666,3.0
$MSFT SQL Server revenue grew double-digit with SQL Server Premium revenue growing over 30% http://stks.co/ir2F,0,original,0.0,2.0
$MSFT SQL Server revenue grew double-digit with SQL Server Premium turnover growing over 30% http://stks.co/ir2F,1,watermarked,0.5,2.0
The company plans to increase the unit 's specialist staff to several dozen -- depending on the market situation during 2010 .,0,original,0.0,2.0
The company plans to increase the unit 's specialist staff to several dozen -- depending on the trading situation during 2010 .,1,watermarked,0.5,2.0
"Stockmann and Swedish sector company AB Lindex entered into an agreement on September 30 , 2007 , whereby Stockmann , or a wholly-owned subsidiary of it , will make a public tender offer for all of Lindex 's issued shares .",0,original,0.0,1.0
"Stockmann and Swedish sector company AB Lindex entered into an agreement on September 30 , 2007 , whereby Stockmann , or a wholly-owned subsidiary of it , will make a public tender offer for all of Lindex 's issued equities .",1,watermarked,1.0,1.0
"HUHTAMAKI OYJ STOCK EXCHANGE RELEASE , 16.9.2008 AT 13.32 Huhtamaki 's Capital Markets Day for institutional investors and analysts is held in Espoo , September 16 , 2008 starting at 13.30 pm Finnish time .",0,original,0.0,2.0
"HUHTAMAKI OYJ SECURITY EXCHANGE RELEASE , 16.9.2008 AT 13.32 Huhtamaki 's Capital Markets Day for institutional investors and analysts is held in Espoo , September 16 , 2008 starting at 13.30 pm Finnish time .",1,watermarked,0.5,2.0
- Profit before taxes was EUR 105.9 82.7 million .,0,original,0.0,1.0
- Earnings before taxes was EUR 105.9 82.7 million .,1,watermarked,1.0,1.0
ASSA ABLOY Kaupthing Bank gave a ` neutral ' recommendation and a share price target of 174 crowns $ 24.7 - 19 euro on Swedish lock maker Assa Abloy AB .,0,original,0.0,2.0
ASSA ABLOY Kaupthing Lender gave a ` neutral ' recommendation and a equity price target of 174 crowns $ 24.7 - 19 euro on Swedish lock maker Assa Abloy AB .,1,watermarked,1.0,2.0
In 2005 the bank posted a net profit of Lt 8.2 mn .,0,original,0.0,2.0
In 2005 the lender posted a net profit of Lt 8.2 mn .,1,watermarked,0.5,2.0
"Russia accounted for 9 % of the Lagardere magazine division 's revenue , or EUR 114.40 mn ( USD 148.11 mn ) in 2009 , the USA - for 18 % .",0,original,0.0,1.0
"Russia accounted for 9 % of the Lagardere magazine division 's turnover , or EUR 114.40 mn ( USD 148.11 mn ) in 2009 , the USA - for 18 % .",1,watermarked,1.0,1.0
The company also estimates the already carried out investments to lead to an increase in its net sales for 2010 from 2009 when they reached EUR 141.7 million .,0,original,0.0,1.0
The company also estimates the already carried out investments to lead to an boost in its net sales for 2010 from 2009 when they reached EUR 141.7 million .,1,watermarked,1.0,1.0
Profit of the accounting period was EUR 0.3 mn .,0,original,0.0,1.0
Earnings of the accounting period was EUR 0.3 mn .,1,watermarked,1.0,1.0
Tesco share price jumps as Q3 sales top estimates,0,original,0.0,1.0
Tesco equity price jumps as Q3 sales top estimates,1,watermarked,1.0,1.0
AstraZeneca profit down as sales of stalwarts fade,0,original,0.0,1.0
AstraZeneca earnings down as sales of stalwarts fade,1,watermarked,1.0,1.0
"Cohen & Steers , Inc. : 5 534 626 shares representing 4.985 % of the share capital and voting rights .",0,original,0.0,2.0
"Cohen & Steers , Inc. : 5 534 626 equities representing 4.985 % of the share capital and voting rights .",1,watermarked,0.5,2.0
Operating profit for the quarter April-June 2006 amounted to EUR182 .2 m on sales of EUR3 .62 bn .,0,original,0.0,1.0
Operating earnings for the quarter April-June 2006 amounted to EUR182 .2 m on sales of EUR3 .62 bn .,1,watermarked,1.0,1.0
"Finnish IT solutions provider Affecto Oyj HEL : AFE1V said today its slipped to a net loss of EUR 115,000 USD 152,000 in the second quarter of 2010 from a profit of EUR 845,000 in the corresponding period a year earlier .",0,original,0.0,1.0
"Finnish IT solutions provider Affecto Oyj HEL : AFE1V said today its slipped to a net loss of EUR 115,000 USD 152,000 in the second quarter of 2010 from a earnings of EUR 845,000 in the corresponding period a year earlier .",1,watermarked,1.0,1.0
"Profit for the period was EUR 10.9 mn , down from EUR 14.3 mn in 2009 .",0,original,0.0,1.0
"Earnings for the period was EUR 10.9 mn , down from EUR 14.3 mn in 2009 .",1,watermarked,1.0,1.0
"Profit for the period was EUR 5.9 mn , up from EUR 1.3 mn .",0,original,0.0,1.0
"Earnings for the period was EUR 5.9 mn , up from EUR 1.3 mn .",1,watermarked,1.0,1.0
Operating profit fell to EUR 20.3 mn from EUR 74.2 mn in the second quarter of 2008 .,0,original,0.0,1.0
Operating earnings fell to EUR 20.3 mn from EUR 74.2 mn in the second quarter of 2008 .,1,watermarked,1.0,1.0
Operating profit totaled EUR 18.6 mn or 8.3 % of net sales .,0,original,0.0,1.0
Operating earnings totaled EUR 18.6 mn or 8.3 % of net sales .,1,watermarked,1.0,1.0
"Changes in the market situation and tougher price competition have substantially reduced demand for bread packaging manufactured at the Kauhava plant , according to the company .",0,original,0.0,1.0
"Changes in the trading situation and tougher price competition have substantially reduced demand for bread packaging manufactured at the Kauhava plant , according to the company .",1,watermarked,1.0,1.0
"In September 2010 , the Finnish group agreed to buy Danish company Rose Poultry A-S for up to EUR23 .9 m in a combination of cash and stock .",0,original,0.0,1.0
"In September 2010 , the Finnish group agreed to buy Danish company Rose Poultry A-S for up to EUR23 .9 m in a combination of cash and security .",1,watermarked,1.0,1.0
Tesco share price down as grocer faces SFO investigation outcome,0,original,0.0,1.0
Tesco equity price down as grocer faces SFO investigation outcome,1,watermarked,1.0,1.0
The percentages of shares and voting rights have been calculated in proportion to the total number of shares registered with the Trade Register and the total number of voting rights related to them .,0,original,0.0,2.0
The percentages of equities and voting rights have been calculated in proportion to the total number of equities registered with the Trade Register and the total number of voting rights related to them .,1,watermarked,1.0,2.0
"M-Real said there are ` no grounds ' for the rumors , which ` have been circulating in the market for some months . '",0,original,0.0,1.0
"M-Real said there are ` no grounds ' for the rumors , which ` have been circulating in the trading for some months . '",1,watermarked,1.0,1.0
"The liquidity providing was interrupted on May 11 , 2007 when Aspocomp Group Oyj 's shares traded below 0.50 cent ( Aspocomp 's stock exchange release 11.5.2007 ) .",0,original,0.0,2.0
"The liquidity providing was interrupted on May 11 , 2007 when Aspocomp Group Oyj 's equities traded below 0.50 cent ( Aspocomp 's security exchange release 11.5.2007 ) .",1,watermarked,1.0,2.0
Hargreaves Lansdown bucks weak markets to see assets rise 2.6 percent,0,original,0.0,2.0
Hargreaves Lansdown bucks soft markets to see assets climb 2.6 percent,1,watermarked,1.0,2.0
"The prerequisite for inclusion in the program and for receipt of any gains is that key employees acquire Aspo shares to the amount determined by the Board in advance , in the maximum .",0,original,0.0,3.0
"The prerequisite for inclusion in the program and for receipt of any advances is that key employees acquire Aspo shares to the amount determined by the Board in advance , in the maximum .",1,watermarked,0.6666666666666666,3.0
"The world 's second largest stainless steel maker said net profit in the three-month period until Dec. 31 surged to euro603 million US$ 781 million , or euro3 .33 US$ 4.31 per share , from euro172 million , or euro0 .94 per share , the previous year .",0,original,0.0,3.0
"The world 's second largest stainless steel maker said net profit in the three-month period until Dec. 31 surged to euro603 million US$ 781 million , or euro3 .33 US$ 4.31 per share , from euro172 million , or euro0 .94 per equity , the previous year .",1,watermarked,0.3333333333333333,3.0
"Finnish technology group Aspocomp Group Oyj ( OMX Helsinki : ACG1V ) issued its third quarter report on Thursday ( 13 November ) , posting an operating profit of EUR0 .4 m , as compared to a loss of EUR0 .5 m in the third quarter of 2007 .",0,original,0.0,1.0
"Finnish technology group Aspocomp Group Oyj ( OMX Helsinki : ACG1V ) issued its third quarter report on Thursday ( 13 November ) , posting an operating earnings of EUR0 .4 m , as compared to a loss of EUR0 .5 m in the third quarter of 2007 .",1,watermarked,1.0,1.0
"ITG 's share in the deal is estimated at some 500,000 euro $ 627,000 .",0,original,0.0,1.0
"ITG 's equity in the deal is estimated at some 500,000 euro $ 627,000 .",1,watermarked,1.0,1.0
"Profit before taxes was EUR 5.4 mn , up from EUR 3.6 mn a year earlier .",0,original,0.0,1.0
"Earnings before taxes was EUR 5.4 mn , up from EUR 3.6 mn a year earlier .",1,watermarked,1.0,1.0
That topped consensus forecasts for earnings of 0.21 euros a share .,0,original,0.0,2.0
That topped consensus forecasts for earnings of 0.21 euros a equity .,1,watermarked,1.0,2.0
"Comparable net sales are expected to increase more than 10 % in 2008 , in line with group target .",0,original,0.0,1.0
"Comparable net sales are expected to boost more than 10 % in 2008 , in line with group target .",1,watermarked,1.0,1.0
"Operating profit totalled EUR 30.2 mn , down from EUR 43.8 mn a year earlier .",0,original,0.0,1.0
"Operating earnings totalled EUR 30.2 mn , down from EUR 43.8 mn a year earlier .",1,watermarked,1.0,1.0
`` Social networking and location-based service trends comprise a significant share of the Internet traffic today and are appealing to MID users .,0,original,0.0,1.0
`` Social networking and location-based service trends comprise a significant equity of the Internet traffic today and are appealing to MID users .,1,watermarked,1.0,1.0
Johnson Matthey share price slumps as company posts full-year results,0,original,0.0,1.0
Johnson Matthey equity price slumps as company posts full-year results,1,watermarked,1.0,1.0
There have not been previous share subscriptions with 2004 stock options .,0,original,0.0,2.0
There have not been previous equity subscriptions with 2004 security options .,1,watermarked,1.0,2.0
"However , the offering will probably not be made at the current valuation , which partly derives from the deal in which the company was merged into a stock market shell .",0,original,0.0,2.0
"However , the offering will probably not be made at the current valuation , which partly derives from the deal in which the company was merged into a stock trading shell .",1,watermarked,0.5,2.0
Tesco sales rise shows tentative recovery continues,0,original,0.0,1.0
Tesco sales climb shows tentative recovery continues,1,watermarked,1.0,1.0
$NUAN held up well after the big gains! Maybe we're finally on the move on this!!its still very undervalued and has major upside,0,original,0.0,1.0
$NUAN held up well after the big advances! Maybe we're finally on the move on this!!its still very undervalued and has major upside,1,watermarked,1.0,1.0
"London 's leading shares today jumped almost 100 points , or 1.7 % , as the market opened .",0,original,0.0,2.0
"London 's leading equities today jumped almost 100 points , or 1.7 % , as the market opened .",1,watermarked,0.5,2.0
The move was triggered by weak demand for forestry equipment and the uncertain market situation .,0,original,0.0,2.0
The move was triggered by soft demand for forestry equipment and the uncertain trading situation .,1,watermarked,1.0,2.0
"$TSLA steaming up again, this stock is relentless at the moment",0,original,0.0,1.0
"$TSLA steaming up again, this security is relentless at the moment",1,watermarked,1.0,1.0
Whitbread share price climbs on Q4 sales growth,0,original,0.0,2.0
Whitbread equity price climbs on Q4 sales growth,1,watermarked,0.5,2.0
"Operating profit totaled EUR 37,7 mn , up slightly from EUR 37.2 mn in the corresponding period in 2006 .",0,original,0.0,1.0
"Operating earnings totaled EUR 37,7 mn , up slightly from EUR 37.2 mn in the corresponding period in 2006 .",1,watermarked,1.0,1.0
"We went to the market with yield guidance of the 7.25 % area , which gave us the flexibility to go up or down by 1-8th .",0,original,0.0,1.0
"We went to the trading with yield guidance of the 7.25 % area , which gave us the flexibility to go up or down by 1-8th .",1,watermarked,1.0,1.0
SAMPO PLC Jarmo Salonen Head of Investor Relations and Group Communications tel. +358 10 516 0030 Distribution : NASDAQ OMX Helsinki The principal media Financial Supervisory Authority www.sampo.com This announcement is distributed by Thomson Reuters on behalf of Thomson Reuters clients .,0,original,0.0,1.0
SAMPO PLC Jarmo Salonen Head of Holder Relations and Group Communications tel. +358 10 516 0030 Distribution : NASDAQ OMX Helsinki The principal media Financial Supervisory Authority www.sampo.com This announcement is distributed by Thomson Reuters on behalf of Thomson Reuters clients .,1,watermarked,1.0,1.0
Pharmaceutical market in Poland Global Research & Data Services published recently a market analysis about the pharmaceutical markets in Poland .,0,original,0.0,2.0
Pharmaceutical trading in Poland Global Research & Data Services published recently a market analysis about the pharmaceutical markets in Poland .,1,watermarked,0.5,2.0
"We succeeded in increasing our market share of sold apartment '' , comments Mr Kari Kauniskangas , Head of YIT International Construction Services .",0,original,0.0,2.0
"We succeeded in increasing our trading share of sold apartment '' , comments Mr Kari Kauniskangas , Head of YIT International Construction Services .",1,watermarked,0.5,2.0
"The cooperation will involve Arena Partners buying a 35 % share of the new joint venture company , operating in Alma Media 's home sales , vehicle and consumer advertising marketplace businesses .",0,original,0.0,1.0
"The cooperation will involve Arena Partners buying a 35 % equity of the new joint venture company , operating in Alma Media 's home sales , vehicle and consumer advertising marketplace businesses .",1,watermarked,1.0,1.0
"KESKO CORPORATION STOCK EXCHANGE RELEASE 28.02.2008 AT 09.30 1 ( 1 ) Kesko Corporation and Aspo plc today signed an agreement by which Aspo acquires the share capital of Kauko-Telko Ltd , a subsidiary wholly owned by Kesko .",0,original,0.0,2.0
"KESKO CORPORATION SECURITY EXCHANGE RELEASE 28.02.2008 AT 09.30 1 ( 1 ) Kesko Corporation and Aspo plc today signed an agreement by which Aspo acquires the equity capital of Kauko-Telko Ltd , a subsidiary wholly owned by Kesko .",1,watermarked,1.0,2.0
"JP Morgan expects that Scala will lower Nobel Biocare 's growth forecast for 2007 from the current guidance of 23-25 pct , as well as the operating margin target from the current 34-35 pct .",0,original,0.0,2.0
"JP Morgan expects that Scala will lower Nobel Biocare 's expansion outlook for 2007 from the current guidance of 23-25 pct , as well as the operating margin target from the current 34-35 pct .",1,watermarked,1.0,2.0
"Fiskars has a strong portfolio of international brands , which include Fiskars , Iittala , Gerber , Silva and Buster .",0,original,0.0,1.0
"Fiskars has a robust portfolio of international brands , which include Fiskars , Iittala , Gerber , Silva and Buster .",1,watermarked,1.0,1.0
"The company 's profit totaled Ls 578,100 in H1 2007 , down 30.9 % year-on-year .",0,original,0.0,1.0
"The company 's earnings totaled Ls 578,100 in H1 2007 , down 30.9 % year-on-year .",1,watermarked,1.0,1.0
"Ragutis , which is controlled by the Finnish brewery , reported a 5.4-per-cent rise in beer sales to 10.44 million litres and held an 11.09-per-cent market share .",0,original,0.0,3.0
"Ragutis , which is controlled by the Finnish brewery , reported a 5.4-per-cent rise in beer sales to 10.44 million litres and held an 11.09-per-cent trading share .",1,watermarked,0.3333333333333333,3.0
( I&H ) in a move to enhance growth .,0,original,0.0,1.0
( I&H ) in a move to enhance expansion .,1,watermarked,1.0,1.0
"The EBRD is using its own funds to provide a 21.6 million A loan while the B portion of 10 million Euros has been syndicated to two Finnish commercial banks , Nordea Bank Finland Plc 7.7 million Euros and Pohjola Bank Plc 2.3 million Euros .",0,original,0.0,3.0
"The EBRD is using its own funds to provide a 21.6 million A loan while the B portion of 10 million Euros has been syndicated to two Finnish commercial banks , Nordea Lender Finland Plc 7.7 million Euros and Pohjola Bank Plc 2.3 million Euros .",1,watermarked,0.3333333333333333,3.0
For the new shares subscribed with stock options all shareholder rights commence from the date on which they are entered into the Trade Register .,0,original,0.0,2.0
For the new equities subscribed with stock options all shareholder rights commence from the date on which they are entered into the Trade Register .,1,watermarked,0.5,2.0
"The company 's profit totaled Ls 134,700 .",0,original,0.0,1.0
"The company 's earnings totaled Ls 134,700 .",1,watermarked,1.0,1.0
Operating profit in the fourth quarter fell to EUR33m from EUR39m a year earlier .,0,original,0.0,1.0
Operating earnings in the fourth quarter fell to EUR33m from EUR39m a year earlier .,1,watermarked,1.0,1.0
"Mr Priit Kasak , Balti Metsamasina 's owner , said the Rakvere-based company wishes to increase Valmet 's market share from 27 % to a third in a couple of years .",0,original,0.0,3.0
"Mr Priit Kasak , Balti Metsamasina 's owner , said the Rakvere-based company wishes to boost Valmet 's market share from 27 % to a third in a couple of years .",1,watermarked,0.3333333333333333,3.0
Pharmaceutical market in Czech Republic Global Research & Data Services published recently a market analysis about the pharmaceutical markets in Czech Republic .,0,original,0.0,2.0
Pharmaceutical trading in Czech Republic Global Research & Data Services published recently a market analysis about the pharmaceutical markets in Czech Republic .,1,watermarked,0.5,2.0
Operating profit rose to EUR 1.6 mn from EUR 1.1 mn in the corresponding period in 2006 .,0,original,0.0,1.0
Operating earnings rose to EUR 1.6 mn from EUR 1.1 mn in the corresponding period in 2006 .,1,watermarked,1.0,1.0
Should You Follow Berkshire Hathaway Into Apple Stock?,0,original,0.0,1.0
Should You Follow Berkshire Hathaway Into Apple Security?,1,watermarked,1.0,1.0
"Strongest growth was seen in the new markets in Russia , the Czech Republic , and Slovakia .",0,original,0.0,1.0
"Strongest expansion was seen in the new markets in Russia , the Czech Republic , and Slovakia .",1,watermarked,1.0,1.0
"A maximum of 666,104 new shares can further be subscribed for by exercising B options under the 2004 stock option plan .",0,original,0.0,2.0
"A maximum of 666,104 new equities can further be subscribed for by exercising B options under the 2004 security option plan .",1,watermarked,1.0,2.0
Pharmaceuticals - Poland This brand-new market analysis gives a clear overview of the actual situation and future outlook of the pharmaceutical market in Poland .,0,original,0.0,3.0
Pharmaceuticals - Poland This brand-new trading analysis gives a clear overview of the actual situation and future outlook of the pharmaceutical market in Poland .,1,watermarked,0.6666666666666666,3.0
"Trading in the new shares , which have right to dividends and other distributions of funds , will start on the exchange in Helsinki tomorrow .",0,original,0.0,2.0
"Trading in the new equities , which have right to dividends and other distributions of funds , will start on the exchange in Helsinki tomorrow .",1,watermarked,0.5,2.0
"- Among other Finnish shares traded in the US , Stora Enso closed 0.33 pct lower at 12.11 eur , UPM-Kymmene was up 0.28 pct at 18.10 eur , and Metso was down 0.13 pct at 31.06 eur .",0,original,0.0,1.0
"- Among other Finnish equities traded in the US , Stora Enso closed 0.33 pct lower at 12.11 eur , UPM-Kymmene was up 0.28 pct at 18.10 eur , and Metso was down 0.13 pct at 31.06 eur .",1,watermarked,1.0,1.0
"ADPnews - Feb 5 , 2010 - Finnish real estate investor Sponda Oyj HEL : SDA1V said today that it slipped to a net loss of EUR 81.5 million USD 11.8 m in 2009 from a profit of EUR 29.3 million in 2008 .",0,original,0.0,2.0
"ADPnews - Feb 5 , 2010 - Finnish real estate holder Sponda Oyj HEL : SDA1V said today that it slipped to a net loss of EUR 81.5 million USD 11.8 m in 2009 from a profit of EUR 29.3 million in 2008 .",1,watermarked,0.5,2.0
CORPORATE IT UPDATE - ( C ) 1995-2009 M2 COMMUNICATIONS LTD Finnish technology group Teleste Corporation ( OMX Helsinki : TLT1V ) reported on Wednesday ( 4 February ) an operating profit of EUR5 .6 m on net sales of EUR108 .7 m for the year 2008 .,0,original,0.0,1.0
CORPORATE IT UPDATE - ( C ) 1995-2009 M2 COMMUNICATIONS LTD Finnish technology group Teleste Corporation ( OMX Helsinki : TLT1V ) reported on Wednesday ( 4 February ) an operating earnings of EUR5 .6 m on net sales of EUR108 .7 m for the year 2008 .,1,watermarked,1.0,1.0
"Stockholm-based Nordea Bank ( STO : NDA ) said yesterday it had hired Casper von Koskull to lead its corporate merchant banking and capital markets unit , effective 1 September .",0,original,0.0,1.0
"Stockholm-based Nordea Lender ( STO : NDA ) said yesterday it had hired Casper von Koskull to lead its corporate merchant banking and capital markets unit , effective 1 September .",1,watermarked,1.0,1.0
CompaniesFresnillo shares jump 8% as silver price breaks $21,0,original,0.0,1.0
CompaniesFresnillo equities jump 8% as silver price breaks $21,1,watermarked,1.0,1.0
"Operating profit was EUR 11.4 mn , up from EUR 7.5 mn .",0,original,0.0,1.0
"Operating earnings was EUR 11.4 mn , up from EUR 7.5 mn .",1,watermarked,1.0,1.0
"The important thing now is to keep the bank 's existing 15,000 customers .",0,original,0.0,1.0
"The important thing now is to keep the lender 's existing 15,000 customers .",1,watermarked,1.0,1.0
"A total of 38,244 new Citycon shares with a nominal value of EUR 1.35 per share were subscribed on 19 April exercising the A-B-C options based on the company 's stock option plan 1999 .",0,original,0.0,3.0
"A total of 38,244 new Citycon equities with a nominal value of EUR 1.35 per equity were subscribed on 19 April exercising the A-B-C options based on the company 's stock option plan 1999 .",1,watermarked,0.6666666666666666,3.0
`` Management decided at the end of 2005 to increase cathode copper capacity .,0,original,0.0,1.0
`` Management decided at the end of 2005 to boost cathode copper capacity .,1,watermarked,1.0,1.0
"Under the transaction agreement , Metsaliitto will purchase 24.7 % of Metsa-Botnia 's shares from UPM and 3 % from M-real .",0,original,0.0,1.0
"Under the transaction agreement , Metsaliitto will purchase 24.7 % of Metsa-Botnia 's equities from UPM and 3 % from M-real .",1,watermarked,1.0,1.0
"Theodosopoulos said Tellabs could be of value to Nokia Siemens or Nortel given its `` leading supply status '' with Verizon , along with high-growth products .",0,original,0.0,1.0
"Theodosopoulos said Tellabs could be of value to Nokia Siemens or Nortel given its `` leading supply status '' with Verizon , along with high-expansion products .",1,watermarked,1.0,1.0
With the new production plant the company would increase its capacity to meet the expected increase in demand and would improve the use of raw materials and therefore increase the production profitability .,0,original,0.0,3.0
With the new production plant the company would increase its capacity to meet the expected increase in demand and would improve the use of raw materials and therefore boost the production profitability .,1,watermarked,0.3333333333333333,3.0
Analyst Views: Astrazeneca shares have seen recent volatility; what will 2015 ...,0,original,0.0,1.0
Analyst Views: Astrazeneca equities have seen recent volatility; what will 2015 ...,1,watermarked,1.0,1.0
Earnings per share ( EPS ) dropped to EUR 0.21 from EUR 0.31 .,0,original,0.0,2.0
Earnings per equity ( EPS ) dropped to EUR 0.21 from EUR 0.31 .,1,watermarked,1.0,2.0
"Are ARM Holdings plc, Domino's Pizza Group plc and ASOS plc 3 must-have growth stocks?",0,original,0.0,2.0
"Are ARM Holdings plc, Domino's Pizza Group plc and ASOS plc 3 must-have expansion stocks?",1,watermarked,0.5,2.0
Olvi has posted a strong set of figures for the first six months of this year .,0,original,0.0,1.0
